{
  "schemaVersion": "1.0.0",
  "name": "humanoid-basic",
  "description": "Fifteen VRM 1.0 humanoid bones for a figure about 1.8 m tall facing +Z, arms hanging down. Left is +X.",
  "bones": [
    {
      "name": "hips",
      "parent": null,
      "position": [0, 0.95, 0],
      "description": "Root. The pelvis, about 0.95 m above the ground."
    },
    {
      "name": "spine",
      "parent": "hips",
      "position": [0, 0.12, 0],
      "limits": {
        "x": [-45, 60],
        "y": [-45, 45],
        "z": [-30, 30]
      }
    },
    {
      "name": "chest",
      "parent": "spine",
      "position": [0, 0.2, 0],
      "limits": {
        "x": [-30, 45],
        "y": [-30, 30],
        "z": [-20, 20]
      }
    },
    {
      "name": "neck",
      "parent": "chest",
      "position": [0, 0.22, 0],
      "limits": {
        "x": [-40, 40],
        "y": [-60, 60],
        "z": [-30, 30]
      }
    },
    {
      "name": "head",
      "parent": "neck",
      "position": [0, 0.08, 0],
      "limits": {
        "x": [-40, 40],
        "y": [-70, 70],
        "z": [-30, 30]
      }
    },
    {
      "name": "leftUpperArm",
      "parent": "chest",
      "position": [0.2, 0.17, 0],
      "limits": {
        "x": [-180, 60],
        "y": [-90, 90],
        "z": [-90, 180]
      }
    },
    {
      "name": "leftLowerArm",
      "parent": "leftUpperArm",
      "position": [0, -0.28, 0],
      "limits": {
        "x": [-150, 0],
        "y": [-90, 90],
        "z": [-10, 10]
      }
    },
    {
      "name": "rightUpperArm",
      "parent": "chest",
      "position": [-0.2, 0.17, 0],
      "limits": {
        "x": [-180, 60],
        "y": [-90, 90],
        "z": [-180, 90]
      }
    },
    {
      "name": "rightLowerArm",
      "parent": "rightUpperArm",
      "position": [0, -0.28, 0],
      "limits": {
        "x": [-150, 0],
        "y": [-90, 90],
        "z": [-10, 10]
      }
    },
    {
      "name": "leftUpperLeg",
      "parent": "hips",
      "position": [0.1, -0.05, 0],
      "limits": {
        "x": [-120, 60],
        "y": [-45, 45],
        "z": [-30, 60]
      }
    },
    {
      "name": "leftLowerLeg",
      "parent": "leftUpperLeg",
      "position": [0, -0.42, 0],
      "limits": {
        "x": [0, 150],
        "y": [-10, 10],
        "z": [-10, 10]
      }
    },
    {
      "name": "leftFoot",
      "parent": "leftLowerLeg",
      "position": [0, -0.4, 0],
      "limits": {
        "x": [-45, 45],
        "y": [-30, 30],
        "z": [-20, 20]
      }
    },
    {
      "name": "rightUpperLeg",
      "parent": "hips",
      "position": [-0.1, -0.05, 0],
      "limits": {
        "x": [-120, 60],
        "y": [-45, 45],
        "z": [-60, 30]
      }
    },
    {
      "name": "rightLowerLeg",
      "parent": "rightUpperLeg",
      "position": [0, -0.42, 0],
      "limits": {
        "x": [0, 150],
        "y": [-10, 10],
        "z": [-10, 10]
      }
    },
    {
      "name": "rightFoot",
      "parent": "rightLowerLeg",
      "position": [0, -0.4, 0],
      "limits": {
        "x": [-45, 45],
        "y": [-30, 30],
        "z": [-20, 20]
      }
    }
  ]
}
